{
  "reason": "Add grouped evidence factor for A1.",
  "nodes": [
    {
      "id": "E3",
      "type": "observation",
      "text": "Third correlated signal",
      "score": 4
    },
    {
      "id": "E4",
      "type": "observation",
      "text": "Fourth correlated signal",
      "score": 4
    }
  ],
  "edges": [
    {
      "id": "E3A1",
      "from": "E3",
      "to": "A1",
      "type": "supports"
    },
    {
      "id": "E4A1",
      "from": "E4",
      "to": "A1",
      "type": "supports"
    }
  ],
  "factors": [
    {
      "id": "F_SUPPORTS_A1_EXTRA",
      "edges": [
        "E3A1",
        "E4A1"
      ],
      "score": 3,
      "note": "New signals are correlated with each other and grouped together."
    }
  ]
}
